{
  "$schema": "https://json-schema.org/draft/2020-12/schema",
  "$id": "https://github.com/tt-a1i/archify/schemas/uml-class.schema.json",
  "title": "Archify UML Class Diagram (Klassendiagramm, UML 2.5 class notation)",
  "type": "object",
  "additionalProperties": false,
  "required": [
    "schema_version",
    "diagram_type",
    "meta",
    "classes",
    "relations"
  ],
  "properties": {
    "schema_version": {
      "const": 1
    },
    "diagram_type": {
      "const": "uml-class"
    },
    "meta": {
      "type": "object",
      "additionalProperties": false,
      "required": [
        "title"
      ],
      "properties": {
        "title": {
          "type": "string",
          "minLength": 1
        },
        "locale": {
          "$ref": "common.schema.json#/$defs/locale"
        },
        "subtitle": {
          "type": "string"
        },
        "output": {
          "type": "string"
        },
        "animation": {
          "$ref": "common.schema.json#/$defs/animation"
        },
        "visual_preset": {
          "$ref": "common.schema.json#/$defs/visualPreset"
        },
        "quality_profile": {
          "$ref": "common.schema.json#/$defs/qualityProfile"
        },
        "views": {
          "$ref": "common.schema.json#/$defs/guidedViews"
        },
        "legend": {
          "type": "object",
          "additionalProperties": false,
          "properties": {
            "mode": { "$ref": "common.schema.json#/$defs/legendMode" },
            "entries": {
              "type": "object",
              "additionalProperties": false,
              "properties": {
                "class": { "$ref": "common.schema.json#/$defs/legendEntry" },
                "abstract": { "$ref": "common.schema.json#/$defs/legendEntry" },
                "interface": { "$ref": "common.schema.json#/$defs/legendEntry" },
                "enum": { "$ref": "common.schema.json#/$defs/legendEntry" },
                "association": { "$ref": "common.schema.json#/$defs/legendEntry" },
                "aggregation": { "$ref": "common.schema.json#/$defs/legendEntry" },
                "composition": { "$ref": "common.schema.json#/$defs/legendEntry" },
                "inheritance": { "$ref": "common.schema.json#/$defs/legendEntry" },
                "realization": { "$ref": "common.schema.json#/$defs/legendEntry" },
                "dependency": { "$ref": "common.schema.json#/$defs/legendEntry" }
              }
            }
          }
        },
        "grid": {
          "type": "object",
          "additionalProperties": false,
          "properties": {
            "colWidth": { "type": "number", "minimum": 160, "maximum": 400 },
            "rowHeight": { "type": "number", "minimum": 96, "maximum": 320 },
            "originX": { "type": "number", "minimum": 32 },
            "originY": { "type": "number", "minimum": 48 }
          }
        },
        "viewBox": {
          "type": "array",
          "prefixItems": [
            {
              "type": "number",
              "minimum": 420
            },
            {
              "type": "number",
              "minimum": 420
            }
          ],
          "items": false,
          "minItems": 2,
          "maxItems": 2
        }
      }
    },
    "groups": {
      "type": "array",
      "maxItems": 8,
      "items": {
        "type": "object",
        "additionalProperties": false,
        "required": [
          "id",
          "label",
          "nodes"
        ],
        "properties": {
          "id": {
            "$ref": "common.schema.json#/$defs/id"
          },
          "label": {
            "type": "string",
            "minLength": 1
          },
          "nodes": {
            "type": "array",
            "minItems": 1,
            "items": {
              "$ref": "common.schema.json#/$defs/id"
            }
          },
          "padding": {
            "type": "number",
            "minimum": 8,
            "maximum": 48
          }
        }
      }
    },
    "classes": {
      "type": "array",
      "minItems": 2,
      "maxItems": 32,
      "items": {
        "type": "object",
        "additionalProperties": false,
        "required": [
          "id",
          "name",
          "col",
          "row"
        ],
        "properties": {
          "id": {
            "$ref": "common.schema.json#/$defs/id"
          },
          "name": {
            "type": "string",
            "minLength": 1
          },
          "kind": {
            "type": "string",
            "enum": [
              "class",
              "abstract",
              "interface",
              "enum"
            ]
          },
          "stereotype": {
            "type": "string",
            "minLength": 1
          },
          "attributes": {
            "type": "array",
            "maxItems": 12,
            "items": {
              "type": "string",
              "minLength": 1
            }
          },
          "methods": {
            "type": "array",
            "maxItems": 12,
            "items": {
              "type": "string",
              "minLength": 1
            }
          },
          "col": {
            "type": "integer",
            "minimum": 0,
            "maximum": 15
          },
          "row": {
            "type": "integer",
            "minimum": 0,
            "maximum": 15
          },
          "dx": {
            "type": "number"
          },
          "dy": {
            "type": "number"
          },
          "width": {
            "type": "number",
            "minimum": 96
          },
          "height": {
            "type": "number",
            "minimum": 40
          }
        }
      }
    },
    "relations": {
      "type": "array",
      "minItems": 1,
      "items": {
        "type": "object",
        "additionalProperties": false,
        "required": [
          "from",
          "to",
          "kind"
        ],
        "properties": {
          "id": {
            "$ref": "common.schema.json#/$defs/id"
          },
          "from": {
            "$ref": "common.schema.json#/$defs/id"
          },
          "to": {
            "$ref": "common.schema.json#/$defs/id"
          },
          "kind": {
            "type": "string",
            "enum": [
              "association",
              "aggregation",
              "composition",
              "inheritance",
              "realization",
              "dependency"
            ]
          },
          "label": {
            "type": "string"
          },
          "note": {
            "type": "string"
          },
          "navigable": {
            "type": "boolean"
          },
          "fromMultiplicity": {
            "$ref": "#/$defs/multiplicity"
          },
          "toMultiplicity": {
            "$ref": "#/$defs/multiplicity"
          },
          "fromRole": {
            "type": "string",
            "minLength": 1
          },
          "toRole": {
            "type": "string",
            "minLength": 1
          },
          "variant": {
            "$ref": "common.schema.json#/$defs/variant"
          },
          "route": {
            "type": "string",
            "enum": [
              "auto",
              "straight",
              "drop",
              "bottom-channel",
              "top-channel",
              "right-channel",
              "left-channel"
            ]
          },
          "fromSide": {
            "$ref": "common.schema.json#/$defs/side"
          },
          "toSide": {
            "$ref": "common.schema.json#/$defs/side"
          },
          "channelX": {
            "type": "number"
          },
          "channelY": {
            "type": "number"
          },
          "cornerRadius": {
            "type": "number",
            "minimum": 0,
            "maximum": 24
          },
          "labelAt": {
            "type": "number",
            "minimum": 0,
            "maximum": 1
          },
          "labelDx": {
            "type": "number"
          },
          "labelDy": {
            "type": "number"
          },
          "labelSegment": {
            "type": "integer",
            "minimum": 0
          },
          "via": {
            "type": "array",
            "items": {
              "$ref": "common.schema.json#/$defs/point"
            }
          },
          "width": {
            "$ref": "common.schema.json#/$defs/relationshipWidth"
          }
        }
      }
    },
    "cards": {
      "$ref": "common.schema.json#/$defs/cards"
    }
  },
  "$defs": {
    "multiplicity": {
      "type": "string",
      "pattern": "^(\\*|[0-9]+)(\\.\\.(\\*|[0-9]+))?$"
    }
  }
}
